[
  {
    "event_id": "evt_000001",
    "event_type": "RATING_UPDATE",
    "product_id": "iphone_15",
    "timestamp": "2026-09-24T12:00:00Z",
    "source": "stream_simulator",
    "payload": {
      "old_rating": 4.7,
      "new_rating": 4.8
    }
  },
  {
    "event_id": "evt_000002",
    "event_type": "NEW_REVIEW",
    "product_id": "iphone_15_pro",
    "timestamp": "2026-09-24T12:00:02Z",
    "source": "stream_simulator",
    "payload": {
      "rating": 4.0,
      "review_id": "rv_stream_0001"
    }
  },
  {
    "event_id": "evt_000003",
    "event_type": "NEW_REVIEW",
    "product_id": "ipad_pro_m4",
    "timestamp": "2026-09-24T12:00:04Z",
    "source": "stream_simulator",
    "payload": {
      "rating": 3.0,
      "review_id": "rv_stream_0002"
    }
  },
  {
    "event_id": "evt_000004",
    "event_type": "NEW_REVIEW",
    "product_id": "iphone_15_pro",
    "timestamp": "2026-09-24T12:00:06Z",
    "source": "stream_simulator",
    "payload": {
      "rating": 5.0,
      "review_id": "rv_stream_0003"
    }
  },
  {
    "event_id": "evt_000005",
    "event_type": "PRICE_UPDATE",
    "product_id": "galaxy_s24",
    "timestamp": "2026-09-24T12:00:08Z",
    "source": "stream_simulator",
    "payload": {
      "old_price": 17990000.0,
      "new_price": 18830000.0
    }
  },
  {
    "event_id": "evt_000006",
    "event_type": "PRICE_UPDATE",
    "product_id": "galaxy_s24_ultra",
    "timestamp": "2026-09-24T12:00:10Z",
    "source": "stream_simulator",
    "payload": {
      "old_price": 29990000.0,
      "new_price": 28790000.0
    }
  },
  {
    "event_id": "evt_000007",
    "event_type": "NEW_REVIEW",
    "product_id": "iphone_15",
    "timestamp": "2026-09-24T12:00:12Z",
    "source": "stream_simulator",
    "payload": {
      "rating": 3.0,
      "review_id": "rv_stream_0006"
    }
  },
  {
    "event_id": "evt_000008",
    "event_type": "NEW_REVIEW",
    "product_id": "xiaomi_14_pro",
    "timestamp": "2026-09-24T12:00:14Z",
    "source": "stream_simulator",
    "payload": {
      "rating": 3.0,
      "review_id": "rv_stream_0007"
    }
  },
  {
    "event_id": "evt_000009",
    "event_type": "PRICE_UPDATE",
    "product_id": "galaxy_s24_ultra",
    "timestamp": "2026-09-24T12:00:16Z",
    "source": "stream_simulator",
    "payload": {
      "old_price": 29990000.0,
      "new_price": 29180000.0
    }
  },
  {
    "event_id": "evt_000010",
    "event_type": "PRICE_UPDATE",
    "product_id": "airpods_pro_2",
    "timestamp": "2026-09-24T12:00:18Z",
    "source": "stream_simulator",
    "payload": {
      "old_price": 5490000.0,
      "new_price": 5480000.0
    }
  },
  {
    "event_id": "evt_000011",
    "event_type": "NEW_REVIEW",
    "product_id": "iphone_15_pro",
    "timestamp": "2026-09-24T12:00:20Z",
    "source": "stream_simulator",
    "payload": {
      "rating": 4.0,
      "review_id": "rv_stream_0010"
    }
  },
  {
    "event_id": "evt_000012",
    "event_type": "RATING_UPDATE",
    "product_id": "ipad_pro_m4",
    "timestamp": "2026-09-24T12:00:22Z",
    "source": "stream_simulator",
    "payload": {
      "old_rating": 4.4,
      "new_rating": 4.7
    }
  },
  {
    "event_id": "evt_000013",
    "event_type": "NEW_REVIEW",
    "product_id": "dell_xps_15",
    "timestamp": "2026-09-24T12:00:24Z",
    "source": "stream_simulator",
    "payload": {
      "rating": 5.0,
      "review_id": "rv_stream_0012"
    }
  },
  {
    "event_id": "evt_000014",
    "event_type": "RATING_UPDATE",
    "product_id": "galaxy_tab_s9",
    "timestamp": "2026-09-24T12:00:26Z",
    "source": "stream_simulator",
    "payload": {
      "old_rating": 4.8,
      "new_rating": 4.9
    }
  },
  {
    "event_id": "evt_000015",
    "event_type": "RATING_UPDATE",
    "product_id": "dell_xps_15",
    "timestamp": "2026-09-24T12:00:28Z",
    "source": "stream_simulator",
    "payload": {
      "old_rating": 4.3,
      "new_rating": 4.0
    }
  },
  {
    "event_id": "evt_000016",
    "event_type": "PRICE_UPDATE",
    "product_id": "sony_wh1000xm5",
    "timestamp": "2026-09-24T12:00:30Z",
    "source": "stream_simulator",
    "payload": {
      "old_price": 7990000.0,
      "new_price": 7850000.0
    }
  },
  {
    "event_id": "evt_000017",
    "event_type": "NEW_REVIEW",
    "product_id": "galaxy_s24",
    "timestamp": "2026-09-24T12:00:32Z",
    "source": "stream_simulator",
    "payload": {
      "rating": 5.0,
      "review_id": "rv_stream_0016"
    }
  },
  {
    "event_id": "evt_000018",
    "event_type": "RATING_UPDATE",
    "product_id": "macbook_pro_m3",
    "timestamp": "2026-09-24T12:00:34Z",
    "source": "stream_simulator",
    "payload": {
      "old_rating": 4.8,
      "new_rating": 4.7
    }
  },
  {
    "event_id": "evt_000019",
    "event_type": "RATING_UPDATE",
    "product_id": "iphone_15_pro",
    "timestamp": "2026-09-24T12:00:36Z",
    "source": "stream_simulator",
    "payload": {
      "old_rating": 4.5,
      "new_rating": 4.4
    }
  },
  {
    "event_id": "evt_000020",
    "event_type": "RATING_UPDATE",
    "product_id": "dell_xps_15",
    "timestamp": "2026-09-24T12:00:38Z",
    "source": "stream_simulator",
    "payload": {
      "old_rating": 4.3,
      "new_rating": 4.9
    }
  },
  {
    "event_id": "evt_000021",
    "event_type": "PRICE_UPDATE",
    "product_id": "galaxy_tab_s9",
    "timestamp": "2026-09-24T12:00:40Z",
    "source": "stream_simulator",
    "payload": {
      "old_price": 16490000.0,
      "new_price": 16150000.0
    }
  },
  {
    "event_id": "evt_000022",
    "event_type": "NEW_REVIEW",
    "product_id": "galaxy_s24_ultra",
    "timestamp": "2026-09-24T12:00:42Z",
    "source": "stream_simulator",
    "payload": {
      "rating": 4.0,
      "review_id": "rv_stream_0021"
    }
  },
  {
    "event_id": "evt_000023",
    "event_type": "NEW_REVIEW",
    "product_id": "galaxy_s24_ultra",
    "timestamp": "2026-09-24T12:00:44Z",
    "source": "stream_simulator",
    "payload": {
      "rating": 5.0,
      "review_id": "rv_stream_0022"
    }
  },
  {
    "event_id": "evt_000024",
    "event_type": "PRICE_UPDATE",
    "product_id": "galaxy_tab_s9",
    "timestamp": "2026-09-24T12:00:46Z",
    "source": "stream_simulator",
    "payload": {
      "old_price": 16490000.0,
      "new_price": 16120000.0
    }
  },
  {
    "event_id": "evt_000025",
    "event_type": "NEW_REVIEW",
    "product_id": "galaxy_s24",
    "timestamp": "2026-09-24T12:00:48Z",
    "source": "stream_simulator",
    "payload": {
      "rating": 4.0,
      "review_id": "rv_stream_0024"
    }
  },
  {
    "event_id": "evt_000026",
    "event_type": "NEW_REVIEW",
    "product_id": "pixel_8_pro",
    "timestamp": "2026-09-24T12:00:50Z",
    "source": "stream_simulator",
    "payload": {
      "rating": 4.0,
      "review_id": "rv_stream_0025"
    }
  },
  {
    "event_id": "evt_000027",
    "event_type": "RATING_UPDATE",
    "product_id": "airpods_pro_2",
    "timestamp": "2026-09-24T12:00:52Z",
    "source": "stream_simulator",
    "payload": {
      "old_rating": 4.8,
      "new_rating": 5.0
    }
  },
  {
    "event_id": "evt_000028",
    "event_type": "NEW_REVIEW",
    "product_id": "pixel_8_pro",
    "timestamp": "2026-09-24T12:00:54Z",
    "source": "stream_simulator",
    "payload": {
      "rating": 3.0,
      "review_id": "rv_stream_0027"
    }
  },
  {
    "event_id": "evt_000029",
    "event_type": "RATING_UPDATE",
    "product_id": "dell_xps_15",
    "timestamp": "2026-09-24T12:00:56Z",
    "source": "stream_simulator",
    "payload": {
      "old_rating": 4.3,
      "new_rating": 4.0
    }
  },
  {
    "event_id": "evt_000030",
    "event_type": "PRICE_UPDATE",
    "product_id": "dell_xps_15",
    "timestamp": "2026-09-24T12:00:58Z",
    "source": "stream_simulator",
    "payload": {
      "old_price": 45990000.0,
      "new_price": 44230000.0
    }
  },
  {
    "event_id": "evt_000031",
    "event_type": "NEW_REVIEW",
    "product_id": "galaxy_s24_ultra",
    "timestamp": "2026-09-24T12:01:00Z",
    "source": "stream_simulator",
    "payload": {
      "rating": 5.0,
      "review_id": "rv_stream_0030"
    }
  },
  {
    "event_id": "evt_000032",
    "event_type": "RATING_UPDATE",
    "product_id": "iphone_15",
    "timestamp": "2026-09-24T12:01:02Z",
    "source": "stream_simulator",
    "payload": {
      "old_rating": 4.7,
      "new_rating": 4.9
    }
  },
  {
    "event_id": "evt_000033",
    "event_type": "NEW_REVIEW",
    "product_id": "iphone_15",
    "timestamp": "2026-09-24T12:01:04Z",
    "source": "stream_simulator",
    "payload": {
      "rating": 3.0,
      "review_id": "rv_stream_0032"
    }
  },
  {
    "event_id": "evt_000034",
    "event_type": "PRICE_UPDATE",
    "product_id": "xiaomi_14_pro",
    "timestamp": "2026-09-24T12:01:06Z",
    "source": "stream_simulator",
    "payload": {
      "old_price": 16990000.0,
      "new_price": 16820000.0
    }
  },
  {
    "event_id": "evt_000035",
    "event_type": "NEW_REVIEW",
    "product_id": "sony_wh1000xm5",
    "timestamp": "2026-09-24T12:01:08Z",
    "source": "stream_simulator",
    "payload": {
      "rating": 5.0,
      "review_id": "rv_stream_0034"
    }
  },
  {
    "event_id": "evt_000036",
    "event_type": "NEW_REVIEW",
    "product_id": "galaxy_tab_s9",
    "timestamp": "2026-09-24T12:01:10Z",
    "source": "stream_simulator",
    "payload": {
      "rating": 5.0,
      "review_id": "rv_stream_0035"
    }
  },
  {
    "event_id": "evt_000037",
    "event_type": "PRICE_UPDATE",
    "product_id": "sony_wh1000xm5",
    "timestamp": "2026-09-24T12:01:12Z",
    "source": "stream_simulator",
    "payload": {
      "old_price": 7990000.0,
      "new_price": 7600000.0
    }
  },
  {
    "event_id": "evt_000038",
    "event_type": "NEW_REVIEW",
    "product_id": "iphone_15",
    "timestamp": "2026-09-24T12:01:14Z",
    "source": "stream_simulator",
    "payload": {
      "rating": 4.0,
      "review_id": "rv_stream_0037"
    }
  },
  {
    "event_id": "evt_000039",
    "event_type": "NEW_REVIEW",
    "product_id": "iphone_15",